{
  "schema": "PREDICTION_PROJECT_TASK_V1",
  "task_id": "DEV-PRED-RESULT-RECEIPT-INSTALL-20261003-E064",
  "source_commit": "458ac86c7a56f4e583b17879cf3f2f9d29a9c461",
  "intelligence_tier": "A",
  "issuer": {
    "model": "GPT-5.6 Sol",
    "reasoning_level": "UNAVAILABLE_TO_RUNTIME"
  },
  "safety": {
    "live_trading": false,
    "paid_actions": false,
    "wallet_actions": false,
    "remote_git_write": false,
    "credential_write": false
  },
  "capabilities": [
    "read_repository",
    "run_project_python",
    "read_runtime",
    "write_runtime",
    "user_service_manage",
    "read_logs"
  ],
  "working_directory": ".",
  "timeout_seconds": 900,
  "notes": "Install assistant-side immutable result receipts without changing production or Tampermonkey. Run stdlib-only tests first. Install only command_bus_poller.py and continuation_manager.py to allowlisted Prediction runtime paths, restart only Prediction wake/command-bus user services, then verify installed bytes and delivery metadata.",
  "operations": [
    {
      "type": "python",
      "argv": [
        "python3",
        "control/bridge_commands/selftest.py"
      ],
      "timeout_seconds": 180
    },
    {
      "type": "python",
      "argv": [
        "python3",
        "control/dev_checks/result_receipt_acceptance_e064.py"
      ],
      "timeout_seconds": 180
    },
    {
      "type": "python",
      "argv": [
        "python3",
        "-m",
        "compileall",
        "-q",
        "control/bridge_commands/command_bus_poller.py",
        "control/tampermonkey_multichat/continuation_manager.py",
        "control/dev_checks/result_receipt_acceptance_e064.py",
        "control/dev_checks/result_receipt_runtime_verify_e064.py"
      ],
      "timeout_seconds": 120
    },
    {
      "type": "install_runtime",
      "source": "control/bridge_commands/command_bus_poller.py",
      "destination": "/home/leonh/.local/share/prediction-command-bus/command_bus_poller.py",
      "mode": 493
    },
    {
      "type": "install_runtime",
      "source": "control/tampermonkey_multichat/continuation_manager.py",
      "destination": "/home/leonh/.local/share/prediction-chat-bridge/continuation_manager.py",
      "mode": 420
    },
    {
      "type": "service",
      "verb": "restart",
      "unit": "prediction-chat-wake.service"
    },
    {
      "type": "service",
      "verb": "is-active",
      "unit": "prediction-chat-wake.service"
    },
    {
      "type": "service",
      "verb": "restart",
      "unit": "prediction-command-bus.timer"
    },
    {
      "type": "service",
      "verb": "start",
      "unit": "prediction-command-bus.service"
    },
    {
      "type": "service",
      "verb": "is-active",
      "unit": "prediction-command-bus.timer"
    },
    {
      "type": "python",
      "argv": [
        "python3",
        "control/dev_checks/result_receipt_runtime_verify_e064.py"
      ],
      "timeout_seconds": 120
    },
    {
      "type": "journal",
      "unit": "prediction-chat-wake.service",
      "lines": 80
    },
    {
      "type": "journal",
      "unit": "prediction-command-bus.service",
      "lines": 80
    }
  ]
}
