{
  "schema": "PREDICTION_PROJECT_TASK_V1",
  "task_id": "DEV-PRED-AUTOBUILD-BUILD-20260930-E040",
  "build_id": "GENERIC-AUTOBUILD-LIFECYCLE-20260930",
  "source_commit": "f96d2e19bb3d9527c9ad482da77eb00f7787229d",
  "intelligence_tier": "A",
  "issuer": {"model": "GPT-5.6 Sol", "reasoning_level": "UNAVAILABLE_TO_RUNTIME"},
  "safety": {
    "live_trading": false,
    "paid_actions": false,
    "wallet_actions": false,
    "remote_git_write": false,
    "credential_write": false
  },
  "capabilities": ["read_repository", "write_worktree", "run_project_python", "run_tests", "local_git"],
  "working_directory": ".",
  "timeout_seconds": 880,
  "operations": [
    {
      "type": "python",
      "argv": ["python3", "control/dev_checks/autobuild_build_e039_runner.py"],
      "test": true,
      "timeout_seconds": 760
    },
    {
      "type": "git",
      "args": ["commit", "-m", "fix: harden generic autobuild lifecycle and runtime pins"],
      "timeout_seconds": 60
    },
    {
      "type": "git",
      "args": ["rev-parse", "HEAD"],
      "timeout_seconds": 30
    }
  ],
  "notes": "Rerun the generic autobuild build after hardening the project-task guard for local-only Git fixture operations. The guard now permits the Git plumbing required by hourly tests and local bare-remotes only when every repository/remote path resolves inside the isolated worktree or task temp. Network remotes, credential operations, remote Git writes, live trading, paid actions and wallet actions remain forbidden. Run targeted planner/retry tests, generic wiring, full tests, pin/provenance checks and local commit. NO_PROVEN_EDGE unchanged."
}
