{
  "schema": "PREDICTION_PROJECT_TASK_V1",
  "task_id": "DEV-PRED-A2Z-R4P2-ASTRA-RETRY-GATE-20261007-N1E62",
  "source_commit": "a87f5333566c4785b37248c1a993e9bad355c582",
  "intelligence_tier": "A",
  "issuer": {
    "model": "GPT-5.6 Sol",
    "reasoning_level": "High"
  },
  "safety": {
    "live_trading": false,
    "paid_actions": false,
    "wallet_actions": false,
    "remote_git_write": false,
    "credential_write": false
  },
  "capabilities": [
    "read_repository",
    "write_worktree",
    "run_project_python",
    "read_runtime",
    "user_service_manage",
    "read_logs"
  ],
  "working_directory": ".",
  "timeout_seconds": 360,
  "notes": "Attempt-3 Astra PREBUILD retry gate. Fail closed unless exact R4P2 task is still PAUSED_USAGE_LIMIT + resume_same_task and retry_at is due (or within 240s, then wait). Only then start exact existing service once. No timer, no new review task, no Sol build/tests/measurement.",
  "operations": [
    {
      "type": "write_text",
      "path": "control/dev_checks/r4p2_astra_retry_gate_n1e62.py",
      "content": "from pathlib import Path\nimport json,time\nbase=Path.home()/\".local/share/prediction-project-executor/campaigns/FULL-A2Z-LIVE-20261004-V4\"\ntask=\"A2Z-V4-ASTRA-PREBUILD-DIRECT-20261007-R4P2\"\nresult=base/\"model_results\"/(task+\".json\")\nif result.is_file():\n    raise SystemExit(10)\nmodels=base/\"models\"\nstate=None\nfor name in (\"CONTINUATION.json\",\"STATE.json\"):\n    p=models/name\n    if not p.is_file():\n        continue\n    try:\n        o=json.loads(p.read_text(encoding=\"utf-8\"))\n    except Exception:\n        continue\n    if isinstance(o,dict) and o.get(\"task_id\")==task:\n        state=o\n        break\nif not isinstance(state,dict):\n    raise SystemExit(20)\nif state.get(\"state\")!=\"PAUSED_USAGE_LIMIT\":\n    raise SystemExit(21)\nif state.get(\"next_action\")!=\"resume_same_task\":\n    raise SystemExit(22)\nattempt=state.get(\"attempt\")\nif attempt not in (None,3):\n    raise SystemExit(24)\nretry_at=state.get(\"retry_at\")\ntry:\n    retry_at=float(retry_at or 0)\nexcept Exception:\n    raise SystemExit(23)\nnow=time.time()\nif retry_at>now:\n    delta=retry_at-now\n    if delta<=240:\n        time.sleep(delta+1)\n    else:\n        raise SystemExit(30)\nraise SystemExit(0)\n"
    },
    {
      "type": "python",
      "argv": [
        "python3",
        "control/dev_checks/r4p2_astra_retry_gate_n1e62.py"
      ],
      "timeout_seconds": 300
    },
    {
      "type": "service",
      "verb": "start",
      "unit": "prediction-a2z-v4-model@A2Z-V4-ASTRA-PREBUILD-DIRECT-20261007-R4P2.service"
    },
    {
      "type": "journal",
      "unit": "prediction-a2z-v4-model@A2Z-V4-ASTRA-PREBUILD-DIRECT-20261007-R4P2.service",
      "lines": 120
    }
  ]
}
