{
  "schema": "PREDICTION_PROJECT_TASK_V1",
  "task_id": "DEV-PRED-CONT-NEXT-1a89382dc23bab417facffc7",
  "source_commit": "1c7a0fe14f094f13a84a583cf2804f879a0faa84",
  "intelligence_tier": "A",
  "issuer": {
    "model": "GPT-5.6 Sol",
    "reasoning_level": "High"
  },
  "safety": {
    "live_trading": false,
    "paid_actions": false,
    "wallet_actions": false,
    "remote_git_write": false,
    "credential_write": false
  },
  "capabilities": [
    "read_repository",
    "write_worktree",
    "run_project_python",
    "read_runtime"
  ],
  "working_directory": ".",
  "timeout_seconds": 120,
  "notes": "Continuation from DEV-PRED-CONT-NEXT-7b8846e9669d7c05da627cc7. Read-only inspect the local executor/result state for the normalization chain (7b8846 and its referenced 50178168/9d4707 tasks) and emit a compact final status: task state, exit/result, whether the normalization patch was applied, focused test outcome if recorded, and local commit if any. No code modification beyond temporary probe file, no tests, no model invocation, no runtime mutation.",
  "operations": [
    {
      "type": "write_text",
      "path": "control/dev_checks/inspect_normalize_chain_1a8938.py",
      "content": "from pathlib import Path\nimport json\nids=['DEV-PRED-CONT-NEXT-7b8846e9669d7c05da627cc7','DEV-PRED-CONT-NEXT-50178168cc8b3a8e879648db','DEV-PRED-CONT-NEXT-9d4707f66ec86d580643a52c']\nroots=[Path.home()/'.local/state/prediction-project-executor',Path.home()/'.local/share/prediction-project-executor']\nrows=[]\nfor tid in ids:\n    hits=[]\n    for root in roots:\n        if root.exists():\n            for p in root.rglob('*'):\n                if p.is_file() and tid in p.name:\n                    hits.append(p)\n    vals=[]\n    for p in hits[:24]:\n        try: txt=p.read_text(errors='replace')\n        except Exception: continue\n        vals.append(str(p)+':'+txt[:5000].replace('\\n',' ').replace('|','/'))\n    rows.append(tid+'=>'+' || '.join(vals))\nprint('ERROR_CLASS=NORMALIZE_CHAIN_FINAL_STATUS')\nprint('ERROR='+' ### '.join(rows)[:14000])\nraise SystemExit(1)\n"
    },
    {
      "type": "python",
      "argv": [
        "python3",
        "control/dev_checks/inspect_normalize_chain_1a8938.py"
      ],
      "timeout_seconds": 60
    }
  ]
}
