{
  "schema": "PREDICTION_PROJECT_TASK_V1",
  "task_id": "DEV-PRED-A2Z-DIRECT-SOL-ROUTING-DIAG-20261007-N1E20",
  "source_commit": "adc409112303689e79ff9a507d18bff0e7b0aa26",
  "intelligence_tier": "C",
  "issuer": {
    "model": "GPT-5.6 Sol",
    "reasoning_level": "High"
  },
  "safety": {
    "live_trading": false,
    "paid_actions": false,
    "wallet_actions": false,
    "remote_git_write": false,
    "credential_write": false
  },
  "capabilities": [
    "read_repository",
    "write_worktree",
    "run_project_python",
    "read_runtime"
  ],
  "working_directory": ".",
  "timeout_seconds": 180,
  "notes": "Read-only diagnosis of N1E15 first failing step by inspecting its isolated worktree and re-running only the synthetic routing test. No model invocation, runtime install/service mutation, bridge mutation, experiment tests/measurement, paid/live/wallet actions.",
  "operations": [
    {
      "type": "write_text",
      "path": "control/dev_checks/diag_n1e15_n1e20.py",
      "content": "from pathlib import Path\nimport json\n\nroot=Path.home()/\".local/share/prediction-project-executor/worktrees/DEV-PRED-A2Z-DIRECT-SOL-ROUTING-TEST-20261007-N1E15\"\nstate=Path.home()/\".local/state/prediction-project-executor/DEV-PRED-A2Z-DIRECT-SOL-ROUTING-TEST-20261007-N1E15.json\"\n\nprint(\"STATE_EXISTS=\"+str(state.exists()))\nif state.exists():\n    obj=json.loads(state.read_text(encoding=\"utf-8\"))\n    print(\"STATE=\"+json.dumps({k:obj.get(k) for k in (\"status\",\"source_commit\",\"remote_commit\",\"claimed_at_utc\")},sort_keys=True))\n\nfor rel in [\n    \"control/model_execution/patch_e106_gate.py\",\n    \"control/jobs/full_a2z_governed_v4.py\",\n    \"control/dev_checks/test_direct_sol_runner_routing_n1e15.py\",\n]:\n    p=root/rel\n    print(rel+\"_EXISTS=\"+str(p.exists()))\n    if p.exists():\n        try:\n            compile(p.read_text(encoding=\"utf-8\"),rel,\"exec\")\n            print(rel+\"_COMPILE=PASS\")\n        except Exception as exc:\n            print(rel+\"_COMPILE=FAIL:\"+exc.__class__.__name__+\":\"+str(exc))\n\n# Re-run only the diagnostic script directly to surface its exact exception.\np=root/\"control/dev_checks/test_direct_sol_runner_routing_n1e15.py\"\nif p.exists():\n    import subprocess,sys\n    cp=subprocess.run([sys.executable,str(p)],cwd=str(root),text=True,stdout=subprocess.PIPE,stderr=subprocess.STDOUT)\n    print(\"REPRO_RC=\"+str(cp.returncode))\n    print(\"REPRO_OUT=\"+cp.stdout[-6000:].replace(\"\\n\",\"\\\\n\"))\n"
    },
    {
      "type": "python",
      "argv": [
        "python3",
        "control/dev_checks/diag_n1e15_n1e20.py"
      ],
      "timeout_seconds": 90
    }
  ]
}
