{
  "schema": "PREDICTION_PROJECT_TASK_V1",
  "task_id": "DEV-PRED-REDDIT-PERSISTENCE-20261008-E007",
  "source_commit": "9de8f784c9fe1e93861efa886220d11419a19f35",
  "intelligence_tier": "B",
  "issuer": {
    "model": "GPT-6",
    "reasoning_level": "UNAVAILABLE_TO_RUNTIME"
  },
  "safety": {
    "live_trading": false,
    "paid_actions": false,
    "wallet_actions": false,
    "remote_git_write": false,
    "credential_write": false
  },
  "capabilities": [
    "read_repository",
    "run_tests",
    "run_project_python"
  ],
  "working_directory": ".",
  "timeout_seconds": 300,
  "notes": "Offline Reddit -> native recon routing export -> real recon run persistence in temp root -> promotion must create 0 candidates from single source. Zero network, paid actions, trading, bridge changes.",
  "operations": [
    {
      "type": "python",
      "argv": [
        "python3",
        "-m",
        "compileall",
        "-q",
        "control/reddit_idea_mine"
      ],
      "timeout_seconds": 60
    },
    {
      "type": "python",
      "argv": [
        "python3",
        "-m",
        "unittest",
        "discover",
        "-s",
        "tests",
        "-p",
        "test_reddit*.py",
        "-v"
      ],
      "test": true,
      "timeout_seconds": 180
    }
  ]
}
