{
  "schema": "PREDICTION_PROJECT_TASK_V1",
  "task_id": "DEV-PRED-CONT-NEXT-b52e706ad08de489ea6f9be9",
  "source_commit": "3b53af5eab8e4516edcdcb34e8e7cd02d50b01d9",
  "intelligence_tier": "A",
  "issuer": {
    "model": "GPT-5.6 Sol",
    "reasoning_level": "High"
  },
  "safety": {
    "live_trading": false,
    "paid_actions": false,
    "wallet_actions": false,
    "remote_git_write": false,
    "credential_write": false
  },
  "capabilities": [
    "read_repository",
    "write_worktree",
    "run_project_python",
    "read_runtime"
  ],
  "working_directory": ".",
  "timeout_seconds": 120,
  "notes": "Continuation for DEV-PRED-ASTRA-RESULT-NORMALIZE-R5-20261008-N1E132 after RESULT_ACK_TIMEOUT. Read only local executor state/result evidence for that exact task and emit compact status, exit/error/detail, operations and local commit if present. Do not modify code, run tests, invoke models, build experiments, or measure.",
  "operations": [
    {
      "type": "write_text",
      "path": "control/dev_checks/read_n1e132_normalize_result_cont_b52e.py",
      "content": "from pathlib import Path\nimport json\ntid='DEV-PRED-ASTRA-RESULT-NORMALIZE-R5-20261008-N1E132'\nroots=[Path.home()/'.local/state/prediction-project-executor',Path.home()/'.local/share/prediction-project-executor']\nhits=[]\nfor root in roots:\n    if root.exists():\n        for p in root.rglob('*'):\n            if p.is_file() and tid in p.name:\n                try:\n                    txt=p.read_text(errors='replace')\n                except Exception:\n                    continue\n                hits.append((str(p),txt))\ndef clean(s):\n    return str(s).replace('\\n',' ').replace('\\r',' ').replace('|','/').replace('{','(').replace('}',')')[:5000]\nprint('ERROR_CLASS=N1E132_NORMALIZE_RESULT')\nparts=[]\nfor path,txt in hits[:20]:\n    try:\n        o=json.loads(txt)\n        parts.append('PATH='+clean(path))\n        for k in ['status','exit_code','error','detail','task_id','branch','worktree','commit','commit_sha','local_commit','operations']:\n            if k in o: parts.append(k.upper()+'='+clean(o[k]))\n    except Exception:\n        parts.append('PATH='+clean(path)+' RAW='+clean(txt[:1200]))\nif not parts: parts=['NO_LOCAL_RESULT_FOUND']\nprint('ERROR='+'|'.join(parts))\nraise SystemExit(1)\n"
    },
    {
      "type": "python",
      "argv": [
        "python3",
        "control/dev_checks/read_n1e132_normalize_result_cont_b52e.py"
      ],
      "timeout_seconds": 60
    }
  ]
}
