{
  "schema": "PREDICTION_PROJECT_TASK_V1",
  "task_id": "DEV-PRED-ASTRA-ACTIVE-ROUTE-DISCOVERY-EXEC-20261005",
  "source_commit": "8d18ff47eef0ff3ddf910e911c7f393d5af25535",
  "intelligence_tier": "C",
  "issuer": {
    "model": "GPT-5.6 Sol",
    "reasoning_level": "UNAVAILABLE_TO_RUNTIME"
  },
  "safety": {
    "live_trading": false,
    "paid_actions": false,
    "wallet_actions": false,
    "remote_git_write": false,
    "credential_write": false
  },
  "capabilities": [
    "read_repository",
    "write_worktree",
    "run_project_python",
    "read_runtime"
  ],
  "working_directory": ".",
  "timeout_seconds": 180,
  "notes": "Read-only classification of recent Astra continuation routes. No bridge, service, route, runtime or market mutation.",
  "operations": [
    {
      "type": "write_text",
      "path": "control/dev_checks/astra_active_route_exec_20261005.py",
      "content": "from pathlib import Path\nimport json\nDATA=Path.home()/'.local/share/prediction-chat-bridge'\nrows=[]\nfor p in (DATA/'continuations').glob('CONT-*.json'):\n    try:o=json.loads(p.read_text(encoding='utf-8'))\n    except Exception:continue\n    if not isinstance(o,dict):continue\n    kind=str(o.get('external_source_kind') or '')\n    if 'ASTRA' not in kind:continue\n    rows.append((float(o.get('updated_at') or o.get('created_at') or 0),str(o.get('expected_route_task_id') or ''),kind,str(o.get('state') or ''),int(o.get('attempts') or 0),int(o.get('last_acked_attempt') or 0)))\nrows.sort(reverse=True)\nacked=[r for r in rows[:40] if r[5]>=1]\nif acked:\n    print('ASTRA_ROUTE_CLASS=RECENT_ACKED route='+acked[0][1]+' kind='+acked[0][2],flush=True)\n    raise SystemExit(41)\nif rows:\n    print('ASTRA_ROUTE_CLASS=NO_ACKED_RECENT count='+str(len(rows))+' newest_route='+rows[0][1]+' newest_kind='+rows[0][2]+' newest_state='+rows[0][3]+' attempts='+str(rows[0][4]),flush=True)\n    raise SystemExit(42)\nprint('ASTRA_ROUTE_CLASS=NONE',flush=True)\nraise SystemExit(43)\n"
    },
    {
      "type": "python",
      "argv": [
        "python3",
        "control/dev_checks/astra_active_route_exec_20261005.py"
      ],
      "timeout_seconds": 60
    }
  ]
}
